Ether / IP / TCP 162.159.135.234:https > 10.30.101.65:47842 PA / Raw
Ether / IP / TCP 162.159.135.234:https > 10.30.101.65:47842 PA / Raw
Ether / IP / TCP 10.30.101.65:47842 > 162.159.135.234:https A
Ether / IP / TCP 10.30.101.65:47812 > 20.10.31.115:https A / Raw
Ether / IP / TCP 20.10.31.115:https > 10.30.101.65:47812 A
Ether / IP / TCP 10.30.101.65:47806 > 142.250.138.188:5228 A / Raw
Ether / IP / TCP 142.250.138.188:5228 > 10.30.101.65:47806 A
Ether / IP / TCP 162.159.135.234:https > 10.30.101.65:47842 PA / Raw
Ether / IP / TCP 162.159.135.234:https > 10.30.101.65:47842 PA / Raw
Ether / IP / TCP 162.159.135.234:https > 10.30.101.65:47842 PA / Raw
